{
  "schema_version": "perception.v1",
  "scene_id": "acceptance_no_destination",
  "coordinate_frame": "world",
  "objects": [
    {
      "id": "red_cube",
      "category": "红色方块",
      "pose": {"x": 0.22, "y": 0.0, "z": 0.04},
      "dimensions": {"x": 0.04, "y": 0.04, "z": 0.04},
      "attributes": {"display_name": "红色方块", "color": "red"},
      "execution": {"movable": true, "graspable": true}
    }
  ],
  "execution_context": {"backend": "mock", "scene_revision": "acceptance-1"}
}
