{
  "schema_version": "perception.v1",
  "scene_id": "stacking_cubes",
  "coordinate_frame": "world",
  "objects": [
    {
      "id": "red_cube",
      "category": "红色方块",
      "pose": {
        "x": 0.25,
        "y": 0.0,
        "z": 0.04
      },
      "dimensions": {
        "x": 0.04,
        "y": 0.04,
        "z": 0.04
      },
      "attributes": {
        "display_name": "红色方块",
        "color": "red"
      },
      "execution": {
        "movable": true,
        "graspable": true
      }
    },
    {
      "id": "green_cube",
      "category": "绿色方块",
      "pose": {
        "x": 0.25,
        "y": 0.0,
        "z": 0.12
      },
      "dimensions": {
        "x": 0.04,
        "y": 0.04,
        "z": 0.04
      },
      "attributes": {
        "display_name": "绿色方块",
        "color": "green"
      },
      "execution": {
        "movable": true,
        "graspable": true
      }
    },
    {
      "id": "zone_unstack_target",
      "category": "桌子",
      "pose": {
        "x": 0.4,
        "y": 0.0,
        "z": 0.03
      },
      "attributes": {
        "purpose": "safe_placement"
      },
      "execution": {
        "movable": false,
        "graspable": false,
        "valid_destination": true
      }
    }
  ],
  "execution_context": {
    "backend": "mock",
    "scene_revision": "1"
  }
}
